Description,ShadowFile,CharacterFile,Item,Group,Condition
The bear must be floating with a balloon.,bearshadow,bearreal,bear ,A,must
The dolphin is playing with a ball.,dolphinshadow,dolphinreal,dophin,A,is
The cat must be practicing the trumpet.,catshadow,catreal,cat,A,must
The cow is jumping over the moon.,cowshadow,cowreal,cow,A,is
The bear is floating with a balloon.,bearshadow,bearreal,bear ,B,is
The dolphin must be playing with a ball.,dolphinshadow,dolphinreal,dolphin,B,must
The cat is practicing the trumpet.,catshadow,catreal,cat,B,is
The cow must be jumping over the moon.,cowshadow,cowreal,cow,B,must
